{
  "grant_id": "grant-repo-write",
  "issuer": "policy:default-coding",
  "holder": "agent:coder-1",
  "session_id": "sess-01JABCDEF0",
  "scope": {
    "selector": { "resource_kind": "file_path", "resource_id": "/repo/beateros" },
    "actions": ["read", "write"]
  },
  "denied_actions": ["delegate", "spend"],
  "constraints": {
    "max_risk": "medium",
    "max_data_class": "code",
    "budget": { "max_tool_calls": 100 },
    "network_allowlist": [],
    "path_prefixes": ["/repo/beateros"]
  },
  "expires_at": "2026-07-03T20:00:00Z",
  "delegation": "attenuated_only",
  "approval": { "mode": "none", "threshold_risk": "critical", "reviewer_ids": [] },
  "revocation_handle": "rev:grant-repo-write",
  "policy_version": "policy-2026.07.0",
  "reason": "Coding session needs to edit files under the target repo",
  "revoked": false
}
